"Author, Year",Title,Journal,Reason,Subreason
"van Riel, 2006",Efficacy and safety of combination etanercept and methotrexate versus etanercept alone in patients with rheumatoid arthritis with an inadequate response to methotrexate: The adore study,Annals of the rheumatic diseases,Outcomes,No outcomes of interest at 24 weeks
"van Vollenhoven, 2009",Addition of infliximab compared with addition of sulfasalazine and hydroxychloroquine to methotrexate in patients with early rheumatoid arthritis (swefot trial): 1-year results of a randomised trial,"Lancet (london, england)",Population,cDMARD na夫e
"van Vollenhoven, 2011","Atacicept in patients with rheumatoid arthritis and an inadequate response to methotrexate: Results of a phase ii, randomized, placebo-controlled trial",Arthritis and rheumatism,Intervention,Atacicept
"van Vollenhoven, 2016","Full dose, reduced dose or discontinuation of etanercept in rheumatoid arthritis",Annals of the rheumatic diseases,Population,Low disease activity population
"van Vollenhoven, 2015","Safety and efficacy of atacicept in combination with rituximab for reducing the signs and symptoms of rheumatoid arthritis: A phase ii, randomized, double-blind, placebo-controlled pilot trial",Arthritis & rheumatology,Intervention,atacicept
"Weinblatt, 2006","Safety of the selective costimulation modulator abatacept in rheumatoid arthritis patients receiving background biologic and nonbiologic disease-modifying antirheumatic drugs: A one-year randomized, placebo-controlled study",Arthritis and rheumatism,Outcomes,No outcomes of interest at 24 weeks
"Weinblatt, 2017","A phase iii study evaluating continuation, tapering, and withdrawal of certolizumab pegol after one year of therapy in patients with early rheumatoid arthritis",Arthritis & rheumatology,Population,cDMARD na夫e
"Weinblatt, 2018",Switching from reference adalimumab to sb5 (adalimumab biosimilar) in patients with rheumatoid arthritis: Fifty-two-week phase iii randomized study results,Arthritis and Rheumatology,Outcomes,No outcomes of interest at 24 weeks
"Weinblatt, 2012",Efficacy and safety of certolizumab pegol in a broad population of patients with active rheumatoid arthritis: Results from the realistic phase iiib study,Arthritis & rheumatology,Outcomes,No outcomes of interest at 24 weeks
"Weinblatt, 2015","Twenty-eight-week results from the realistic phase iiib randomized trial: Efficacy, safety and predictability of response to certolizumab pegol in a diverse rheumatoid arthritis population",Arthritis research & therapy,Outcomes,No outcomes of interest at 24 weeks
"Weinblatt, 2008","Efficacy and safety of etanercept 50 mg twice a week in patients with rheumatoid arthritis who had a suboptimal response to etanercept 50 mg once a week: Results of a multicenter, randomized, double-blind, active drug-controlled study",Arthritis and rheumatism,Intervention,Dose randomization
"Weinblatt, 2007",Selective costimulation modulation using abatacept in patients with active rheumatoid arthritis while receiving etanercept: A randomised clinical trial,Annals of the rheumatic diseases,Outcomes,No outcomes of interest at 24 weeks
"Weisman, 2003","Efficacy, pharmacokinetic, and safety assessment of adalimumab, a fully human anti-tumor necrosis factor-alpha monoclonal antibody, in adults with rheumatoid arthritis receiving concomitant methotrexate: A pilot study",Clinical therapeutics,Intervention,Dose randomization
"Weisman, 2007","A placebo-controlled, randomized, double-blinded study evaluating the safety of etanercept in patients with rheumatoid arthritis and concomitant comorbid diseases",Rheumatology ,Population,Restricted to patients with comorbidities
"Westhovens, 2006","A phase i study assessing the safety, clinical response, and pharmacokinetics of an experimental infliximab formulation for subcutaneous or intramuscular administration in patients with rheumatoid arthritis",Journal of rheumatology,Outcomes,No outcomes of interest at 24 weeks
"Westhovens, 2015",Maintenance of remission following 2 years of standard treatment then dose reduction with abatacept in patients with early rheumatoid arthritis and poor prognosis,Annals of the rheumatic diseases,Population,Low disease activity population
"Wijesinghe, 2017",Leflunomide is equally efficacious and safe compared to low dose rituximab in refractory rheumatoid arthritis given in combination with methotrexate: Results from a randomized double blind controlled clinical trial,BMC Musculoskeletal Disorders,Comparator,Leflunomide
"Williams, 2016","Comparative assessment of clinical response in patients with rheumatoid arthritis between pf-05280586, a proposed rituximab biosimilar, and rituximab",British journal of clinical pharmacology,Study design,Modelling study
"Wislowska, 2007",Preliminary evaluation in rheumatoid arthritis activity in patients treated with tnf-alpha blocker plus methotrexate versus methotrexate or leflunomide alone,Rheumatology International,Study design,Non-randomized
"Xia, 2016",Iguratimod in combination with methotrexate in active rheumatoid arthritis : Therapeutic effects,Zeitschrift fur rheumatologie,Intervention,Iguaratimod
"Yoo, 2013","A randomised, double-blind, parallel-group study to demonstrate equivalence in efficacy and safety of ct-p13 compared with innovator infliximab when coadministered with methotrexate in patients with active rheumatoid arthritis: The planetra study",Annals of the rheumatic diseases,Outcomes,No outcomes of interest at 24 weeks
"Yoo, 2016",A phase iii randomized study to evaluate the efficacy and safety of ct-p13 compared with reference infliximab in patients with active rheumatoid arthritis: 54-week results from the planetra study,Arthritis research & therapy,Outcomes,No outcomes of interest at 24 weeks
"Yoo, 2017","A multicentre randomised controlled trial to compare the pharmacokinetics, efficacy and safety of ct-p10 and innovator rituximab in patients with rheumatoid arthritis",Annals of the rheumatic diseases,Study design,Phase 1
"Yoo, 2017","Efficacy, safety and pharmacokinetics of up to two courses of the rituximab biosimilar ct-p10 versus innovator rituximab in patients with rheumatoid arthritis: Results up to week 72 of a phase i randomized controlled trial",BioDrugs,Outcomes,No outcomes of interest at 24 weeks
"Zhang, 2006",Infliximab versus placebo in rheumatoid arthritis patients receiving concomitant methotrexate: A preliminary study from china,APLAR Journal of Rheumatology,Outcomes,No outcomes of interest at 24 weeks
"Zhang, 2013",Pharmacokinetics and pharmacodynamics of tocilizumab after subcutaneous administration in patients with rheumatoid arthritis,International journal of clinical pharmacology and therapeutics,Outcomes,No outcomes of interest at 24 weeks
"Zhao, 2017",Analysis of efficacy and safety of treatment of active rheumatoid arthritis with iguratimod and methotrexate,Biomedical Research (India),Population,cDMARD na夫e
"Zhou, 2007","Pharmacokinetics and safety of golimumab, a fully human anti-tnf-alpha monoclonal antibody, in subjects with rheumatoid arthritis",Journal of clinical pharmacology,Outcomes,No outcomes of interest